{"title":"Open Small Business Records Taxonomy","short_name":"OSBRT","namespace":"osbrt","version":"0.1.0","status":"released","maintainer":"Eterna Clarity","license":null,"classification_principle":"Assign one primary category by the business responsibility that needs the information to stay correct; keep secondary contexts as relationships or metadata.","accountability_test":"If this record became wrong or disappeared tomorrow, which business responsibility would have to fix the problem?","small_business_note":"Categories describe responsibilities, not departments. One person can own several responsibilities.","tie_breakers":["Responsibility beats file format, document type, and department name.","Financial transaction evidence stays in Finance when finance is its primary purpose.","Customer relationships stay with Customers; specific execution stays with Projects.","Procurement stays with Vendors; resulting purchase invoices normally stay with Finance.","Employment relationships stay with People; payroll accounting and remittances normally stay with Finance.","Physical asset records stay with Assets; stock movement and control stay with Inventory.","Claims and incidents stay with Risk; formal licence and compliance evidence stay with Compliance.","System ownership, access, configuration, recovery, and technology services stay with Technology.","Recurring methods stay with Operations; future direction with Strategy; reusable handoff knowledge with Knowledge.","Never displace a required legal, regulatory, accounting, payroll, or contractual system of record."],"recommended_metadata":[{"field":"primary_category_id","purpose":"Stable OSBRT category for primary operational meaning."},{"field":"record_type","purpose":"Human record type; not the primary category."},{"field":"responsible_business_area","purpose":"Responsibility that owns correctness; one person may fill several."},{"field":"status","purpose":"Current business state."},{"field":"sensitivity","purpose":"Local handling cue; not a legal classification."},{"field":"review_or_lifecycle_state","purpose":"When or why review, renewal, supersession, or closure is needed."},{"field":"related_categories","purpose":"Other OSBRT categories materially related to the record."},{"field":"related_entities","purpose":"Related customer, vendor, worker, project, asset, account, or location."},{"field":"authority_reference","purpose":"Pointer to the authoritative system/original; never store secrets here."}],"categories":[{"id":"osbrt.governance_ownership","name":"Governance & ownership","definition":"Records that establish the business entity, ownership, formal authority, governance structure, or major company decisions.","responsibility":"Ownership and formal company authority.","examples":["articles or certificate of incorporation","shareholder or ownership register"],"use_when":"Entity, ownership, formal authority, or governance action is the primary responsibility.","handling_cue":"highly_sensitive","review_trigger":"incorporation or restructuring","related_categories":["osbrt.finance_accounting_tax","osbrt.people_workforce"]},{"id":"osbrt.finance_accounting_tax","name":"Finance, accounting & tax","definition":"Accounting books, transaction evidence, banking, receivables and payables, expenses, reconciliations, financial reporting, tax, and financial-remittance records.","responsibility":"Bookkeeping, cash, financial reporting, tax, and transaction evidence.","examples":["sales invoice","purchase invoice"],"use_when":"The record primarily evidences, records, reconciles, reports, pays, collects, or supports a financial/tax obligation.","handling_cue":"highly_sensitive","review_trigger":"month or year close","related_categories":["osbrt.customers_revenue","osbrt.vendors_procurement"]},{"id":"osbrt.customers_revenue","name":"Customers & revenue","definition":"Records that define, develop, manage, or document customer relationships, commercial opportunities, sales commitments, and ongoing customer accounts.","responsibility":"Sales and the ongoing customer relationship.","examples":["lead or opportunity record","proposal"],"use_when":"The commercial customer relationship is primary; specific execution belongs with Projects.","handling_cue":"often_sensitive","review_trigger":"new lead or customer","related_categories":["osbrt.finance_accounting_tax","osbrt.projects_jobs_delivery"]},{"id":"osbrt.vendors_procurement","name":"Vendors & procurement","definition":"Records used to source, evaluate, select, order from, manage, and communicate with suppliers and service providers.","responsibility":"Purchasing and supplier management.","examples":["supplier profile","supplier quote"],"use_when":"Choosing, ordering from, or managing a supplier is primary; transaction evidence normally belongs with Finance.","handling_cue":"often_sensitive","review_trigger":"new or terminated supplier","related_categories":["osbrt.finance_accounting_tax","osbrt.inventory_supplies"]},{"id":"osbrt.people_workforce","name":"People & workforce","definition":"Employment, contractor, role, compensation-administration, time, training, performance, and other workforce records about people working for or with the business.","responsibility":"Employment and contractor administration.","examples":["employment agreement","contractor agreement"],"use_when":"The working relationship or workforce administration is primary; payroll accounting/remittance evidence normally belongs with Finance.","handling_cue":"highly_sensitive","review_trigger":"hire or contract start","related_categories":["osbrt.finance_accounting_tax","osbrt.projects_jobs_delivery"]},{"id":"osbrt.projects_jobs_delivery","name":"Projects, jobs & delivery","definition":"Records that define, execute, change, approve, evidence, complete, or hand off specific customer work, projects, jobs, engagements, or deliverables.","responsibility":"Delivery of the specific job, project, or engagement.","examples":["work order","statement of work"],"use_when":"Execution or delivery of a defined job, project, engagement, or deliverable is primary.","handling_cue":"often_sensitive","review_trigger":"project or job opened","related_categories":["osbrt.customers_revenue","osbrt.finance_accounting_tax"]},{"id":"osbrt.operations_procedures","name":"Operations & procedures","definition":"Recurring operating procedures, checklists, schedules, instructions, quality methods, and routine process records used to run the business consistently.","responsibility":"The recurring process or operating method.","examples":["standard operating procedure","recurring checklist"],"use_when":"A repeatable operating method is primary; topic-specific notes/checklists stay with their actual subject.","handling_cue":"context_dependent","review_trigger":"process change","related_categories":["osbrt.projects_jobs_delivery","osbrt.people_workforce"]},{"id":"osbrt.assets_facilities","name":"Assets & facilities","definition":"Records that identify, assign, operate, service, inspect, repair, warrant, or manage physical assets, equipment, vehicles, tools, premises, and facilities.","responsibility":"The asset, equipment, vehicle, premises, or facility.","examples":["asset register","vehicle or equipment record"],"use_when":"Asset identity, custody, condition, operation, maintenance, warranty, inspection, or facilities management is primary.","handling_cue":"often_sensitive","review_trigger":"purchase or disposal","related_categories":["osbrt.finance_accounting_tax","osbrt.vendors_procurement"]},{"id":"osbrt.inventory_supplies","name":"Inventory & supplies","definition":"Records used to identify, count, receive, store, issue, consume, reorder, adjust, or trace inventory, stock, materials, and recurring supplies.","responsibility":"Stock availability, movement, and material control.","examples":["SKU or item master","stock count"],"use_when":"Stock or supply control is primary; supplier selection stays with Vendors and invoices stay with Finance.","handling_cue":"context_dependent","review_trigger":"receipt or shipment","related_categories":["osbrt.vendors_procurement","osbrt.finance_accounting_tax"]},{"id":"osbrt.insurance_risk_incidents","name":"Insurance, risk & incidents","definition":"Insurance policies and certificates, claims, risk assessments, incident records, damage evidence, loss events, and other records primarily used to understand or manage business risk.","responsibility":"Insurance, claims, risk response, loss prevention, and incident handling.","examples":["insurance policy","certificate of insurance"],"use_when":"Insurance, claims, risk, or incident handling is primary unless formal compliance evidence is the main purpose.","handling_cue":"highly_sensitive","review_trigger":"policy renewal or change","related_categories":["osbrt.assets_facilities","osbrt.compliance_licences_safety"]},{"id":"osbrt.compliance_licences_safety","name":"Compliance, licences & safety","definition":"Licences, permits, required certifications, regulated inspections, safety-program evidence, compliance records, and other material maintained primarily to demonstrate required permission or adherence.","responsibility":"The licence, safety duty, regulatory requirement, or compliance evidence.","examples":["business licence","permit"],"use_when":"A legal, regulatory, licensing, safety, or professional requirement is the record’s main purpose.","handling_cue":"often_sensitive","review_trigger":"licence or permit renewal","related_categories":["osbrt.insurance_risk_incidents","osbrt.people_workforce"]},{"id":"osbrt.technology_access_data","name":"Technology, access & data","definition":"Records that define, operate, administer, secure, recover, or document business systems, software, accounts, access, data handling, and technology services.","responsibility":"The system, account, access model, configuration, data process, backup, or technology service.","examples":["system inventory","software subscription re